{
  "schema_version": 1,
  "classification": "SYNTHETIC",
  "problem_id": "water_quality.reference",
  "formulation_id": "notebook_one_hop_milp",
  "dataset": {
    "path": "synthetic-grid.geojson"
  },
  "parameters": {
    "n_free": 5,
    "budget": 2,
    "weights": [
      0.3671,
      0.1224,
      0.2508,
      0.0502,
      0.1278,
      0.0183,
      0.0476,
      0.0159
    ],
    "beta": 1,
    "delta": 1,
    "time_limit": 30
  },
  "description": "Fully imaginary nine-by-nine projected grid; local adjacency benchmark only"
}
